{
  "$schema": "https://json-schema.org/draft/2020-12/schema",
  "$id": "source",
  "title": "source",
  "type": "object",
  "required": [
    "id",
    "type",
    "name",
    "status",
    "confidence",
    "updated",
    "url",
    "kind",
    "accessed"
  ],
  "properties": {
    "id": {
      "type": "string",
      "pattern": "^[a-z0-9]+(-[a-z0-9]+)*$"
    },
    "type": {
      "const": "source"
    },
    "name": {
      "type": "string"
    },
    "status": {
      "enum": [
        "verified",
        "draft",
        "contested",
        "deprecated"
      ]
    },
    "confidence": {
      "type": "number"
    },
    "updated": {
      "type": "string",
      "pattern": "^\\d{4}-\\d{2}-\\d{2}$"
    },
    "url": {
      "type": "string"
    },
    "publisher": {
      "type": [
        "string",
        "null"
      ]
    },
    "kind": {
      "enum": [
        "spec-sheet",
        "whitepaper",
        "paper",
        "benchmark",
        "repo",
        "release-notes",
        "forum",
        "blog",
        "interview",
        "review",
        "database"
      ]
    },
    "published": {
      "type": [
        "string",
        "null"
      ]
    },
    "accessed": {
      "type": "string",
      "pattern": "^\\d{4}-\\d{2}-\\d{2}$"
    },
    "archived_url": {
      "type": [
        "string",
        "null"
      ]
    },
    "vendor_silence": {
      "type": [
        "string",
        "null"
      ],
      "enum": [
        "export-control",
        "paywall",
        "aggregator-only",
        "no-config.json",
        null
      ],
      "description": "the mechanism behind vendor silence when a first-party document does not exist in public. Distinguishes the four mechanisms identified in w10-vendors-who-publish-nothing-export-control-paywall-and-aggregator-only that produce low confidence (0.3-0.5): export-control = legal restriction preventing public datasheet publication (e.g. nv-h20-flopper-specsheet); paywall = commercial silence where document is restricted to members/subscribers (e.g. nrg2-uptime-institute-survey-paywalled); aggregator-only = vendor publishes no specifications or spec table, forcing reliance on secondary aggregators (e.g. cn-cambricon-mlu590, cn-iluvatar-bi-v150); no-config.json = packaging artifact where hosted model repo lacks architecture config (e.g. hf-embed-voyage-code-3). null = not established."
    },
    "notes": {
      "type": "string"
    }
  },
  "additionalProperties": false
}
