{
  "id": "mlperf-inference-v6-1-summary-xlsx",
  "name": "MLCommons MLPerf Inference v6.1 results \u2014 official summary.xlsx (datacenter + edge, closed + open divisions)",
  "url": "https://github.com/mlcommons/inference_results_v6.1/raw/refs/heads/main/summary.xlsx",
  "publisher": "MLCommons",
  "kind": "benchmark",
  "notes": "Official MLPerf Inference v6.1 published results workbook. Rows carry submitter, system, accelerator count, software stack, scenario and units verbatim. Token/s figures are system-aggregate output throughput for Offline/Server/Interactive scenarios; SingleStream rows are latency ms. Vendor/submitter-measured under MLCommons audit.",
  "status": "verified",
  "confidence": 0.7,
  "published": null,
  "accessed": "2026-10-15",
  "archived_url": null,
  "updated": "2026-10-15",
  "type": "source"
}