{
  "id": "mbl-cfg-minimax-m1",
  "type": "source",
  "name": "MiniMaxAI/MiniMax-M1 config.json",
  "status": "verified",
  "confidence": 0.9,
  "updated": "2026-10-04",
  "url": "https://huggingface.co/MiniMaxAI/MiniMax-M1/raw/main/config.json",
  "publisher": "Hugging Face",
  "kind": "repo",
  "published": null,
  "accessed": "2026-10-04",
  "archived_url": null,
  "notes": "Hybrid lightning-attention. rope_scaling null, rope_theta 10000000, max_position_embeddings 10240000. Read raw 2026-10-04."
}
