{
  "id": "iree-intermediate-representation-execution-environment",
  "type": "source",
  "name": "IREE: Intermediate Representation Execution Environment",
  "status": "verified",
  "confidence": 0.85,
  "updated": "2026-10-10",
  "url": "https://iree.dev/",
  "publisher": "IREE Project / LF AI & Data Foundation",
  "kind": "repo",
  "published": null,
  "accessed": "2026-10-04",
  "archived_url": null,
  "notes": "IREE is an MLIR-based end-to-end compiler and runtime. Lowers ML models to unified IR. Supports JAX, ONNX, PyTorch, TensorFlow/TFLite import. Targets Linux, Windows, macOS, Android, iOS, bare metal, WebAssembly. Architectures: ARM, x86, RISC-V. APIs: Vulkan, ROCm/HIP, CUDA, Metal, AMD AIE (experimental), WebGPU (experimental). Joined LF AI & Data Foundation 2024-05-23. Binary size as low as 30KB on embedded.\n\nW10 LOWCONFIDENCE PROVENANCE AUDIT 2026-10-10: re-classified UNCHECKED after an actual re-fetch. Fetched from this host: HTTP 200 with substantive body text. WHAT WAS READ: iree.dev landing page, live.. The page is first-party for the named publisher and live. Raised 0.5 -> 0.85, status draft -> verified. This record remains a SELF-DESCRIPTION page, not an independent measurement, so it does not reach the 0.9+ tier reserved for verified against-primary-source numbers."
}
