{
  "id": "phi4minir-card",
  "type": "source",
  "name": "Phi-4-mini-reasoning model card",
  "status": "verified",
  "confidence": 0.8,
  "updated": "2026-10-19",
  "url": "https://huggingface.co/microsoft/Phi-4-mini-reasoning/raw/main/README.md",
  "publisher": "",
  "kind": "blog",
  "published": null,
  "accessed": "2026-10-19",
  "archived_url": null,
  "notes": "Read https://huggingface.co/microsoft/Phi-4-mini-reasoning/raw/main/README.md for the benchmark figures recorded on Phi-4-mini-reasoning."
}
