{
  "id": "hf-cantina-security-apex-flash-1",
  "type": "source",
  "name": "cantina-security/apex-flash-1 model card",
  "status": "verified",
  "confidence": 0.85,
  "updated": "2026-10-25",
  "url": "https://huggingface.co/cantina-security/apex-flash-1",
  "publisher": "cantina-security",
  "kind": "repo",
  "published": "2026-09-30",
  "accessed": "2026-10-25",
  "archived_url": null,
  "notes": "Fetched 2026-10-25. Repo created 2026-09-30, licence mit, base_model zai-org/GLM-5.3-Flash (kind: rl). Safetensors total 321323031390. Tags: transformers, safetensors, glm5_next, image-text-to-text, conversational, en, zh, base_model:zai-org/GLM-5.3-Flash."
}
