{
  "id": "consumer-intel-arc-b580-ark-specifications",
  "type": "source",
  "name": "Intel Arc B580 Graphics ARK product specifications (SKU 241598)",
  "status": "verified",
  "confidence": 0.85,
  "updated": "2026-10-03",
  "url": "https://www.intel.com/content/www/us/en/products/sku/241598/intel-arc-b580-graphics/specifications.html",
  "publisher": "Intel",
  "kind": "spec-sheet",
  "published": null,
  "accessed": "2026-10-03",
  "archived_url": null,
  "notes": "Vendor primary specification document. Figures transcribed verbatim from the document's spec table; any vendor marketing precision labels (e.g. 'AI TOPS') keep their vendor definition in the referencing accelerator's notes."
}
