{
  "id": "quant-llmint8-paper",
  "type": "source",
  "name": "LLM.int8(): 8-bit Matrix Multiplication for Transformers at Scale",
  "status": "verified",
  "confidence": 0.9,
  "updated": "2026-10-03",
  "url": "https://arxiv.org/abs/2208.07339",
  "publisher": "arXiv",
  "kind": "paper",
  "published": "2022-08-15",
  "accessed": "2026-10-03",
  "archived_url": null,
  "notes": "v2. Vector-wise quantization + mixed-precision 16-bit outlier decomposition."
}
