{
  "id": "chihaoy-ai-100-server-qwen3-30b-on-4x-cloud-ai-100-server",
  "type": "source",
  "name": "chihaoy/AI_100_server — Qwen3-30B on 4x Cloud AI 100 server",
  "status": "draft",
  "confidence": 0.5,
  "updated": "2026-10-14",
  "url": "https://github.com/chihaoy/AI_100_server",
  "publisher": "chihaoy",
  "kind": "repo",
  "published": null,
  "accessed": "2026-10-14",
  "archived_url": null,
  "notes": ""
}
