{
  "id": "picclick-ebay-aggregator-rtx-3090-used-asking-listings",
  "type": "source",
  "name": "PicClick eBay aggregator: RTX 3090 used asking listings",
  "status": "draft",
  "confidence": 0.5,
  "updated": "2026-10-19",
  "url": "https://picclick.com/?q=rtx+3090",
  "publisher": "PicClick / eBay",
  "kind": "forum",
  "published": null,
  "accessed": "2026-10-19",
  "archived_url": null,
  "notes": ""
}
