{
  "id": "raspberry-pi-ai-hat-plus-2-product-page",
  "type": "source",
  "name": "Raspberry Pi AI HAT+ 2 product page (Hailo-10H)",
  "url": "https://www.raspberrypi.com/products/ai-hat-plus-2/",
  "publisher": "Raspberry Pi",
  "kind": "spec-sheet",
  "status": "draft",
  "confidence": 0.7,
  "updated": "2026-10-14",
  "accessed": "2026-10-14",
  "archived_url": null,
  "published": null,
  "vendor_silence": null,
  "notes": ""
}
