{
  "id": "hf-edge-phi-4-mini-instruct",
  "type": "source",
  "name": "microsoft/Phi-4-mini-instruct config.json",
  "status": "verified",
  "confidence": 0.88,
  "updated": "2026-10-10",
  "url": "https://huggingface.co/microsoft/Phi-4-mini-instruct/raw/main/config.json",
  "publisher": "Hugging Face",
  "kind": "repo",
  "published": null,
  "accessed": "2026-10-03",
  "archived_url": null,
  "notes": "Phi-4 mini is the first Phi to use GQA in this size class (24 query / 8 KV heads) and adds partial_rotary_factor 0.75 plus full_attn_mod. Primary source for every architecture field in this record; values read from the repo's config.json, not from a model card summary.\n\nW10 LOWCONFIDENCE PROVENANCE AUDIT 2026-10-10: re-classified UNCHECKED after an actual re-fetch. Fetched over HTTPS from this host: HTTP 200, the returned file is live JSON and parses. Every architecture field this note names was then read back out of the live config.json and matches the note's value field-for-field. The 0.5 rating therefore marked a lookup nobody had run, not a property of the source: it is the model publisher's own repository, so it is a primary-shaped source, and the one caveat is that it is a mirror for the license-gated originals (see 'a-hosting-platform-is-not-a-vendor' and the gated-repo records). Raised 0.5 -> 0.88, status draft -> verified."
}