{
  "id": "src-incoai-splash-issue-37",
  "type": "source",
  "name": "Benchmark comparison on MacBook Pro M3 Max 128GB: Splash, Ollama (MLX), and Ollama (llama.cpp) across Qwen3.6-35B and Qwen3.8-27B",
  "status": "verified",
  "confidence": 0.8,
  "updated": "2026-10-11",
  "url": "https://github.com/incoai/splash/issues/37",
  "publisher": "incoai / community",
  "kind": "benchmark",
  "published": "2026-09-30",
  "accessed": "2026-10-11",
  "archived_url": null,
  "notes": "Direct head-to-head empirical measurement on MacBook Pro M3 Max (16C CPU / 40C GPU, 128 GB unified memory at 400 GB/s) comparing MLX and llama.cpp runtimes under Ollama on the exact same machine and hardware state."
}